==============================================
QUIC Performance Test - 20GB File Transfer
Runs per configuration: 5
==============================================

[0;34mCalculating server-side BLAKE3 hash (this will take a minute)...[0m
BLAKE3 not found, using MD5...
Server hash: 24eeb2845cbfda238b78fa165c21607d (saved to test-www/test_20gb.bin.md5)


==============================================
[0;33mRunning Vanilla QUIC Tests[0m
==============================================

==============================================
[0;32mTest: Vanilla QUIC (Standard) (Run 1/5)[0m
==============================================
[0;34mStarting server...[0m
[0;34mDownloading 20GB file...[0m
Started at: 2026-02-16 21:30:19
Download completed at: 2026-02-16 21:31:29
[0;34mCalculating client-side hash...[0m
Hash verification completed at: 2026-02-16 21:32:01
[0;32m✓ SUCCESS: Hashes match![0m

=== Run 1 Results ===
Download time:      70.789255409s
Hash time:          31.625756215s
Total time:         102.415011624s
Throughput:         2314.47 Mbps
Integrity check:    PASS

==============================================
[0;32mTest: Vanilla QUIC (Standard) (Run 2/5)[0m
==============================================
[0;34mStarting server...[0m
[0;34mDownloading 20GB file...[0m
Started at: 2026-02-16 21:32:07
Download completed at: 2026-02-16 21:33:17
[0;34mCalculating client-side hash...[0m
Hash verification completed at: 2026-02-16 21:33:47
[0;32m✓ SUCCESS: Hashes match![0m

=== Run 2 Results ===
Download time:      70.175208060s
Hash time:          29.926902413s
Total time:         100.102110473s
Throughput:         2334.72 Mbps
Integrity check:    PASS

==============================================
[0;32mTest: Vanilla QUIC (Standard) (Run 3/5)[0m
==============================================
[0;34mStarting server...[0m
[0;34mDownloading 20GB file...[0m
Started at: 2026-02-16 21:33:53
Download completed at: 2026-02-16 21:35:03
[0;34mCalculating client-side hash...[0m
Hash verification completed at: 2026-02-16 21:35:34
[0;32m✓ SUCCESS: Hashes match![0m

=== Run 3 Results ===
Download time:      70.151994624s
Hash time:          30.914923926s
Total time:         101.066918550s
Throughput:         2335.50 Mbps
Integrity check:    PASS

==============================================
[0;32mTest: Vanilla QUIC (Standard) (Run 4/5)[0m
==============================================
[0;34mStarting server...[0m
[0;34mDownloading 20GB file...[0m
Started at: 2026-02-16 21:35:40
Download completed at: 2026-02-16 21:36:49
[0;34mCalculating client-side hash...[0m
Hash verification completed at: 2026-02-16 21:37:25
[0;32m✓ SUCCESS: Hashes match![0m

=== Run 4 Results ===
Download time:      69.230186717s
Hash time:          35.881699086s
Total time:         105.111885803s
Throughput:         2366.59 Mbps
Integrity check:    PASS

==============================================
[0;32mTest: Vanilla QUIC (Standard) (Run 5/5)[0m
==============================================
[0;34mStarting server...[0m
[0;34mDownloading 20GB file...[0m
Started at: 2026-02-16 21:37:31
Download completed at: 2026-02-16 21:38:42
[0;34mCalculating client-side hash...[0m
Hash verification completed at: 2026-02-16 21:39:14
[0;32m✓ SUCCESS: Hashes match![0m

=== Run 5 Results ===
Download time:      71.677324836s
Hash time:          31.209235729s
Total time:         102.886560565s
Throughput:         2285.79 Mbps
Integrity check:    PASS


==============================================
[0;33mRunning PQDR-QUIC Tests[0m
==============================================

==============================================
[0;32mTest: PQDR-QUIC (Post-Quantum Double-Ratchet) (Run 1/5)[0m
==============================================
[0;34mStarting server...[0m
[0;34mDownloading 20GB file...[0m
Started at: 2026-02-16 21:39:19
Download completed at: 2026-02-16 21:40:32
[0;34mCalculating client-side hash...[0m
Hash verification completed at: 2026-02-16 21:41:02
[0;32m✓ SUCCESS: Hashes match![0m

=== Run 1 Results ===
Download time:      72.436065473s
Hash time:          30.370458151s
Total time:         102.806523624s
Throughput:         2261.85 Mbps
Integrity check:    PASS

==============================================
[0;32mTest: PQDR-QUIC (Post-Quantum Double-Ratchet) (Run 2/5)[0m
==============================================
[0;34mStarting server...[0m
[0;34mDownloading 20GB file...[0m
Started at: 2026-02-16 21:41:08
Download completed at: 2026-02-16 21:42:22
[0;34mCalculating client-side hash...[0m
Hash verification completed at: 2026-02-16 21:42:52
[0;32m✓ SUCCESS: Hashes match![0m

=== Run 2 Results ===
Download time:      73.814771727s
Hash time:          30.539333840s
Total time:         104.354105567s
Throughput:         2219.60 Mbps
Integrity check:    PASS

==============================================
[0;32mTest: PQDR-QUIC (Post-Quantum Double-Ratchet) (Run 3/5)[0m
==============================================
[0;34mStarting server...[0m
[0;34mDownloading 20GB file...[0m
Started at: 2026-02-16 21:42:58
Download completed at: 2026-02-16 21:44:15
[0;34mCalculating client-side hash...[0m
Hash verification completed at: 2026-02-16 21:44:45
[0;32m✓ SUCCESS: Hashes match![0m

=== Run 3 Results ===
Download time:      76.471327623s
Hash time:          30.680691991s
Total time:         107.152019614s
Throughput:         2142.50 Mbps
Integrity check:    PASS

==============================================
[0;32mTest: PQDR-QUIC (Post-Quantum Double-Ratchet) (Run 4/5)[0m
==============================================
[0;34mStarting server...[0m
[0;34mDownloading 20GB file...[0m
Started at: 2026-02-16 21:44:51
Download completed at: 2026-02-16 21:46:06
[0;34mCalculating client-side hash...[0m
Hash verification completed at: 2026-02-16 21:46:35
[0;32m✓ SUCCESS: Hashes match![0m

=== Run 4 Results ===
Download time:      74.616091982s
Hash time:          28.692605144s
Total time:         103.308697126s
Throughput:         2195.77 Mbps
Integrity check:    PASS

==============================================
[0;32mTest: PQDR-QUIC (Post-Quantum Double-Ratchet) (Run 5/5)[0m
==============================================
[0;34mStarting server...[0m
[0;34mDownloading 20GB file...[0m
Started at: 2026-02-16 21:46:40
Download completed at: 2026-02-16 21:47:55
[0;34mCalculating client-side hash...[0m
Hash verification completed at: 2026-02-16 21:48:26
[0;32m✓ SUCCESS: Hashes match![0m

=== Run 5 Results ===
Download time:      75.022515235s
Hash time:          30.334569155s
Total time:         105.357084390s
Throughput:         2183.87 Mbps
Integrity check:    PASS


==============================================
[0;32mAggregate Statistics[0m
==============================================

[0;34mVanilla QUIC Statistics:[0m
  Throughput:
    Mean:     2327.41 Mbps
    Median:   2334.72 Mbps
    StdDev:   26.6593323247 Mbps
    Min:      2285.79 Mbps
    Max:      2366.59 Mbps
    CV:       1.00%

  Download Time:
    Mean:     70.40s
    Median:   70.175208060s
    StdDev:   .8079083745s
    Min:      69.230186717s
    Max:      71.677324836s

[0;34mPQDR-QUIC Statistics:[0m
  Throughput:
    Mean:     2200.71 Mbps
    Median:   2195.77 Mbps
    StdDev:   39.4748020894 Mbps
    Min:      2142.50 Mbps
    Max:      2261.85 Mbps
    CV:       1.00%

  Download Time:
    Mean:     74.47s
    Median:   74.616091982s
    StdDev:   1.3340271327s
    Min:      72.436065473s
    Max:      76.471327623s

[0;34mPerformance Comparison:[0m
  PQDR vs Vanilla:
    Throughput difference: 5.00%
    Download time overhead: -5.00%

==============================================
[0;32mPerformance testing complete![0m
==============================================

Results saved to: 60s_ratchet.txt
